{
  "$schema": "../../schemas/vocabulary.schema.json",
  "id": "seat-roles",
  "label": "Seat roles",
  "description": "What one player in a multi-seat unit controls.",
  "group": "supporting",
  "status": "approved",
  "version": "1.1.0",
  "terms": [
    {
      "id": "driver",
      "label": "Driver / pilot",
      "description": "Moves the unit. In a solo unit also aims, fires and uses abilities.",
      "source_rule": "Never written as the seat of a weapon or ability on a source unit: a weapon or ability with no seat belongs to the driver. It may still be listed in crew.seats."
    },
    {
      "id": "gunner",
      "label": "Gunner",
      "description": "Aims and fires a weapon."
    },
    {
      "id": "commander",
      "label": "Commander",
      "description": "Spots, marks and sees further; triggers abilities or a secondary weapon. Also a crew seat that only loads, repairs or runs systems; list it in crew.seats and say what it does in crew.notes.",
      "examples": [
        "Foxhole: the commander directs the crew and can open the cupola to look out",
        "Battlefield 3 main battle tanks: the CITV Station seat laser-marks targets for the driver's guided shells"
      ]
    },
    {
      "id": "passenger-cargo",
      "label": "Passenger (cargo)",
      "description": "Rides inside, protected, and can't act until they get out."
    },
    {
      "id": "passenger-firing",
      "label": "Passenger (firing)",
      "description": "Rides inside and fires their own weapon out of a port or an open top.",
      "examples": [
        "PlanetSide 2: rumble seats let riders use their own weapons, exposed to fire",
        "Halo: the Mongoose passenger fires their own weapon"
      ]
    },
    {
      "id": "passenger-module",
      "label": "Passenger (module)",
      "description": "Who rides inside decides the vehicle's weapon or ability; the passenger may aim it.",
      "examples": ["Red Alert 3: the Multigunner IFV's weapon depends on its passenger"]
    }
  ]
}
