{
  "$schema": "../../schemas/vocabulary.schema.json",
  "id": "handling",
  "label": "Handling",
  "description": "How the controls feel: the first thing a player notices about a unit.",
  "group": "supporting",
  "status": "draft",
  "version": "0.3.0",
  "terms": [
    {
      "id": "strafe",
      "label": "Strafe",
      "description": "Moves in any direction regardless of facing and turns instantly; the twin-stick default.",
      "rarity": "common"
    },
    {
      "id": "pivot",
      "label": "Pivot (tank controls)",
      "description": "Turns the hull on the spot, then drives forward or back; can't strafe.",
      "rarity": "common"
    },
    {
      "id": "steer",
      "label": "Steer",
      "description": "Turns only while moving, in arcs; fast on straights, can't turn in place.",
      "rarity": "common"
    },
    {
      "id": "drift",
      "label": "Drift",
      "description": "Keeps momentum and slides through turns; needs room to stop.",
      "rarity": "uncommon"
    },
    {
      "id": "forward-only",
      "label": "Forward only",
      "description": "Must keep moving forward and turns in wide loops; attacks in passes.",
      "rarity": "uncommon"
    }
  ]
}
