{
  "$schema": "../../schemas/vocabulary.schema.json",
  "id": "ratings",
  "label": "Ratings",
  "description": "Low / medium / high on the scale of the field that uses it. For team-play potential higher is better; for build difficulty and risks higher is worse.",
  "group": "supporting",
  "status": "approved",
  "version": "1.1.0",
  "terms": [
    {
      "id": "low",
      "label": "Low",
      "description": "Low on this field's scale.",
      "rank": 1
    },
    {
      "id": "medium",
      "label": "Medium",
      "description": "Medium on this field's scale.",
      "rank": 2
    },
    {
      "id": "high",
      "label": "High",
      "description": "High on this field's scale.",
      "rank": 3
    }
  ]
}
