{
  "$schema": "../../schemas/vocabulary.schema.json",
  "id": "balance-flags",
  "label": "Balance flags",
  "description": "Warnings the generator puts on a card. 'Block' flags never appear on rolled cards, only on hand-edited or remixed ones.",
  "group": "supporting",
  "status": "draft",
  "version": "1.0.0",
  "terms": [
    {
      "id": "no-counter",
      "label": "No counter",
      "description": "Nothing in the data can satisfy any of the card's 'countered by' links.",
      "severity": "block"
    },
    {
      "id": "strength-without-weakness",
      "label": "Unpaired strength",
      "description": "A strength has no weakness paired with it.",
      "severity": "block"
    },
    {
      "id": "too-many-keys-for-tier",
      "label": "Too many keys for its tier",
      "description": "Keys or passives exceed the tier's budget.",
      "severity": "block"
    },
    {
      "id": "seat-overloaded",
      "label": "Seat overloaded",
      "description": "One seat has more keys than the per-seat limit.",
      "severity": "block"
    },
    {
      "id": "idle-seat",
      "label": "Idle seat",
      "description": "An operating seat owns no weapon or ability.",
      "severity": "block"
    },
    {
      "id": "cost-outside-tier",
      "label": "Cost outside tier",
      "description": "The derived cost band doesn't fit the tier.",
      "severity": "warn"
    },
    {
      "id": "name-collision",
      "label": "Name too close to a real unit",
      "description": "The working name matches a real unit name in the database.",
      "severity": "block"
    },
    {
      "id": "hard-control-without-escape",
      "label": "Control without escape",
      "description": "A stun, freeze or attach effect with no stated way for the victim to escape.",
      "severity": "block"
    },
    {
      "id": "off-flavour",
      "label": "Off-flavour",
      "description": "Uses parts the faction flavour avoids (allowed at high spice).",
      "severity": "warn"
    }
  ]
}
