{
  "$schema": "../../schemas/vocabulary.schema.json",
  "id": "resources",
  "label": "Resources",
  "description": "A unit-wide gauge that shapes how the unit plays. A card has at most one.",
  "group": "supporting",
  "status": "draft",
  "version": "0.3.0",
  "terms": [
    {
      "id": "heat",
      "label": "Shared heat",
      "description": "Weapons and abilities add heat to one gauge; overheating shuts the unit down briefly."
    },
    {
      "id": "energy",
      "label": "Energy pool",
      "description": "One pool feeds weapons, shields and abilities, so the player chooses what to spend it on."
    },
    {
      "id": "fuel",
      "label": "Fuel",
      "description": "Flight or boost time drains a gauge that refills on the ground or at a pad."
    },
    {
      "id": "limited-ammo",
      "label": "Limited ammo",
      "description": "Total ammo is finite; a supporter, a pickup or the base refills it."
    },
    {
      "id": "kill-charge",
      "label": "Kill charge",
      "description": "A meter filled by kills or damage dealt powers an upgrade or an ultimate."
    }
  ]
}
