{
  "$schema": "../../schemas/vocabulary.schema.json",
  "id": "team-play-hooks",
  "label": "Team-play hooks",
  "description": "The ways a unit creates teamwork. Used on patterns and cards, and filterable in the library.",
  "group": "supporting",
  "status": "approved",
  "version": "1.0.0",
  "terms": [
    {
      "id": "setup-finisher",
      "label": "Setup and finisher",
      "description": "One player changes a target's state (stun, freeze, strip shields) so another can convert it into a kill."
    },
    {
      "id": "rescue",
      "label": "Rescue",
      "description": "Teammates can undo a specific enemy effect on a victim: remove a parasite, unfreeze, revive."
    },
    {
      "id": "seat-synergy",
      "label": "Seat synergy",
      "description": "Who rides inside changes or boosts the unit."
    },
    {
      "id": "carry",
      "label": "Carry",
      "description": "Moves teammates where they need to be."
    },
    {
      "id": "protector",
      "label": "Protector",
      "description": "Shields, heals or repairs others on an ongoing basis."
    },
    {
      "id": "resupply",
      "label": "Resupply",
      "description": "Refills teammates' ammo, energy, fuel or ability charges, or needs teammates to refill its own."
    },
    {
      "id": "forward-spawn",
      "label": "Forward spawn",
      "description": "Gives teammates a place to respawn or re-equip near the fight."
    },
    {
      "id": "spotter",
      "label": "Spotter",
      "description": "Gives the team information: reveals or marks targets."
    },
    {
      "id": "bait-and-trap",
      "label": "Bait and trap",
      "description": "Lures enemies into teammates or a trap."
    },
    {
      "id": "escort-dependency",
      "label": "Needs an escort",
      "description": "Strong, but helpless against its counter without a bodyguard."
    },
    {
      "id": "counter-pick",
      "label": "Counter-pick",
      "description": "The enemy team must coordinate unit choices to answer it."
    },
    {
      "id": "swarm",
      "label": "Swarm",
      "description": "Several players on the same unit type stack their effects."
    },
    {
      "id": "share-spoils",
      "label": "Share the spoils",
      "description": "Gains from kills (salvage, pickups) can be handed to or earned with teammates."
    }
  ]
}
