{
  "$schema": "../../schemas/vocabulary.schema.json",
  "id": "mobility",
  "label": "Mobility types",
  "description": "How the unit moves. Each type lists the classes that may use it (this is how 'aircraft don't get tracks' is enforced), its default handling, the speeds that make sense, and what kind of target it is (a flier is in low air or high air).",
  "group": "core",
  "status": "draft",
  "version": "0.4.0",
  "terms": [
    {
      "id": "foot",
      "label": "On foot",
      "description": "Walks and runs. Can take cover and enter buildings and vehicles.",
      "classes": ["infantry"],
      "rarity": "common",
      "default_handling": "strafe",
      "target_type": "infantry",
      "allowed": {
        "speed-bands": ["slow", "medium", "fast"]
      }
    },
    {
      "id": "jetpack",
      "label": "Jetpack / wings",
      "description": "Personal flight at low height on a jetpack or wings. Hops over walls and hovers; counts as a low flier while airborne.",
      "classes": ["infantry"],
      "rarity": "uncommon",
      "default_handling": "strafe",
      "target_type": "low-air",
      "allowed": {
        "speed-bands": ["medium", "fast"]
      }
    },
    {
      "id": "wheels",
      "label": "Wheels",
      "description": "Fast on roads and open ground, turns in arcs, struggles on rough terrain.",
      "classes": ["vehicle", "drone"],
      "rarity": "common",
      "default_handling": "steer",
      "target_type": "ground-vehicle",
      "allowed": {
        "speed-bands": ["medium", "fast", "very-fast"]
      }
    },
    {
      "id": "tracks",
      "label": "Tracks",
      "description": "Slower, but turns on the spot and handles rough ground.",
      "classes": ["vehicle", "drone"],
      "rarity": "common",
      "default_handling": "pivot",
      "target_type": "ground-vehicle",
      "allowed": {
        "speed-bands": ["very-slow", "slow", "medium", "fast"]
      }
    },
    {
      "id": "legs-biped",
      "label": "Two legs",
      "description": "Walks on two legs, stepping over low walls and swaying as it moves. Small ones are nimble; big ones are slow and imposing.",
      "classes": ["walker"],
      "rarity": "common",
      "default_handling": "pivot",
      "target_type": "ground-vehicle",
      "allowed": {
        "speed-bands": ["very-slow", "slow", "medium", "fast"]
      }
    },
    {
      "id": "legs-multi",
      "label": "Many legs",
      "description": "Three or more legs, like a spider or a four-legged walker. Stable, scuttles over rubble and can straddle obstacles.",
      "classes": ["walker", "drone"],
      "rarity": "uncommon",
      "default_handling": "pivot",
      "target_type": "ground-vehicle",
      "allowed": {
        "speed-bands": ["slow", "medium", "fast", "very-fast"]
      }
    },
    {
      "id": "hover",
      "label": "Hover",
      "description": "Air cushion or anti-grav. Crosses land and water, drifts in turns, avoids steep slopes.",
      "classes": ["hover", "drone"],
      "rarity": "common",
      "default_handling": "drift",
      "target_type": "ground-vehicle",
      "allowed": {
        "speed-bands": ["medium", "fast", "very-fast"]
      },
      "notes": "Only for ground-level skimmers, which ground weapons hit like any vehicle. If it flies over cliffs and walls, use hovering flight (a low flier) instead."
    },
    {
      "id": "rotor",
      "label": "Hovering flight",
      "description": "Rotor, VTOL or anti-grav flight. Can hover in place and strafe. Flies low, so most direct-fire weapons can reach it, not only anti-air.",
      "classes": ["aircraft", "drone"],
      "rarity": "common",
      "default_handling": "strafe",
      "target_type": "low-air",
      "allowed": {
        "speed-bands": ["medium", "fast", "very-fast"]
      }
    },
    {
      "id": "jet",
      "label": "Jet",
      "description": "Fixed-wing flight. Very fast, must keep moving and attacks in passes. Flies high, so only anti-air weapons reach it.",
      "classes": ["aircraft"],
      "rarity": "uncommon",
      "default_handling": "forward-only",
      "target_type": "high-air",
      "allowed": {
        "speed-bands": ["fast", "very-fast"]
      }
    },
    {
      "id": "airship",
      "label": "Airship",
      "description": "Lighter-than-air flight. Very slow and very tough; a looming, visible threat that flies high, so only anti-air weapons reach it.",
      "classes": ["aircraft"],
      "rarity": "rare",
      "default_handling": "drift",
      "target_type": "high-air",
      "min_tier": "t3",
      "allowed": {
        "speed-bands": ["very-slow", "slow"]
      }
    },
    {
      "id": "naval-surface",
      "label": "Ship hull",
      "description": "Floats on the water surface. Research only.",
      "classes": ["naval"],
      "source_only": true,
      "target_type": "naval"
    },
    {
      "id": "naval-submerged",
      "label": "Submarine",
      "description": "Moves underwater, surfacing to attack or be seen. Research only.",
      "classes": ["naval"],
      "source_only": true,
      "target_type": "naval"
    }
  ]
}
