{
  "$schema": "../../schemas/vocabulary.schema.json",
  "id": "classes",
  "label": "Unit classes",
  "description": "What kind of body the player controls. The six generator classes come from the brief; 'naval' is kept for research only. Rarity applies only when the class is left open; a class you pick is always used.",
  "group": "core",
  "status": "approved",
  "version": "1.1.0",
  "terms": [
    {
      "id": "infantry",
      "label": "Infantry",
      "description": "A soldier on foot, from rifleman to power-suit trooper or war animal. Small hitbox, uses cover, can enter vehicles and buildings.",
      "rarity": "common"
    },
    {
      "id": "vehicle",
      "label": "Tank / ground vehicle",
      "description": "A wheeled or tracked ground vehicle: buggies, tanks, IFVs and APCs, artillery. This is the brief's 'tank' class, widened so IFVs and buggies fit.",
      "rarity": "common",
      "aliases": ["tank"]
    },
    {
      "id": "walker",
      "label": "Walker / mech",
      "description": "A vehicle on legs, from a nimble scout walker to a towering assault mech (rarely a giant war beast). Steps over low obstacles and has a strong silhouette.",
      "rarity": "common",
      "aliases": ["mech"]
    },
    {
      "id": "hover",
      "label": "Hovercraft",
      "description": "Rides on an air cushion or anti-grav field, so it crosses land and water. Slides and drifts when it turns.",
      "rarity": "uncommon"
    },
    {
      "id": "aircraft",
      "label": "Aircraft",
      "description": "A flyer bigger than a drone, usually crewed: helicopter, VTOL, jet or airship (rarely remote-piloted, or a flying beast). Hovering flight is low air; jets and airships are high air. Ignores ground obstacles; a top-down view needs a clear height cue such as a shadow.",
      "rarity": "common"
    },
    {
      "id": "drone",
      "label": "Drone / support",
      "description": "A small uncrewed machine or support device: attack, scout and repair drones and deployable gadgets. Usually fast and fragile; the player is the machine.",
      "rarity": "uncommon",
      "notes": "Only for uncrewed units of tiny or small size (the size rule is checked), however they move: a small spider robot on legs is a drone, not a walker. Bigger robots are classed by how they move. Support is a role, not a class: a repair truck is a vehicle with the support role.",
      "allowed": {
        "sizes": ["tiny", "small"]
      }
    },
    {
      "id": "naval",
      "label": "Naval (research only)",
      "description": "Ships and submarines. Recorded only when they teach a mechanic, such as submerging. The generator never rolls this class.",
      "source_only": true
    }
  ]
}
