{
  "$schema": "../../schemas/vocabulary.schema.json",
  "id": "rarity",
  "label": "Rarity",
  "description": "How readily the generator offers a term at each spice level (1 = grounded, 5 = wild). Weights are relative. A term can have its own rarity for some classes (its class rarity): a part that is possible but unusual for a class, such as a flamethrower on an aircraft, is rare there and so appears only from spice 4. A faction's favoured parts count one step more common for that faction, except where a class rarity applies. Rarity applies only to parts the generator picks; a class or part you choose yourself is always used.",
  "group": "supporting",
  "status": "draft",
  "version": "0.4.0",
  "terms": [
    {
      "id": "common",
      "label": "Common",
      "description": "Offered at every spice level, a little less often as spice rises.",
      "rank": 1,
      "min_spice": 1,
      "weights": [10, 10, 8, 6, 5]
    },
    {
      "id": "uncommon",
      "label": "Uncommon",
      "description": "Offered from spice 2.",
      "rank": 2,
      "min_spice": 2,
      "weights": [0, 4, 5, 6, 6]
    },
    {
      "id": "rare",
      "label": "Rare",
      "description": "Offered from spice 4; the rare cross-overs.",
      "rank": 3,
      "min_spice": 4,
      "weights": [0, 0, 0, 3, 5]
    }
  ]
}
