{
  "$schema": "../../schemas/vocabulary.schema.json",
  "id": "on-death",
  "label": "On death",
  "description": "What happens when the unit is destroyed. A card has one or two.",
  "group": "supporting",
  "status": "draft",
  "version": "0.4.0",
  "terms": [
    {
      "id": "respawn",
      "label": "Respawn",
      "description": "The unit is lost and the player returns to the buy screen.",
      "rarity": "common"
    },
    {
      "id": "bail-out",
      "label": "Bail out",
      "description": "The vehicle is destroyed and its crew eject as basic infantry with low health.",
      "rarity": "common",
      "excluded": {
        "classes": ["infantry"]
      }
    },
    {
      "id": "wreck",
      "label": "Wreck",
      "description": "Leaves a wreck that teammates can repair or enemies can salvage.",
      "rarity": "uncommon",
      "excluded": {
        "classes": ["infantry"]
      }
    },
    {
      "id": "death-blast",
      "label": "Death blast",
      "description": "Explodes on death, damaging everything nearby.",
      "rarity": "uncommon"
    },
    {
      "id": "pilot-eject",
      "label": "Pilot eject",
      "description": "The pilot pops out in a light suit and can reach a new unit or a pickup.",
      "rarity": "uncommon",
      "classes": ["walker", "aircraft", "vehicle", "hover"]
    }
  ]
}
