{
  "$schema": "../../schemas/vocabulary.schema.json",
  "id": "tiers",
  "label": "Tier bands",
  "description": "How early, cheap and complex a unit is. Tiers cap the number of keys: every button except primary fire and movement (secondary weapon, active abilities, toggles, deploys, key-bound movement, ultimate). The cap is a maximum, not a target, and counts innate abilities only. Universal keys that every unit shares never count: E interact (enter or leave a seat, pick up), hold F shake off anything attached to you, hold X bail out of a vehicle, 1-3 switch seat, middle mouse ping, and G for a transport's driver to evict passengers. A signature fired with primary fire counts as primary fire only when it is the unit's primary weapon. For source units the tier comes from tech gating alone; games without tech tiers record none. Some games use 'tier' for upgraded versions of the same vehicle (Foxhole, Halo Wars): record those as upgrades, not tiers. The game's tier_map, read with its registry notes, decides what counts as a tech step. An add-on or research that is not on it, such as StarCraft II's Tech Lab or Reactor, is not a step; one the notes translate into a tier, such as Dawn of War's Monastery, is. A unit of a game without tech tiers has no tier and is never checked against a term's min_tier.",
  "group": "core",
  "status": "draft",
  "version": "1.0.0",
  "terms": [
    {
      "id": "t1",
      "label": "T1",
      "description": "Early: cheap, available from the start, simple and readable.",
      "rank": 1,
      "max_keys": 2,
      "max_passive": 1,
      "max_keys_per_seat": 3,
      "source_rule": "Built from a basic production building with no extra tech."
    },
    {
      "id": "t2",
      "label": "T2",
      "description": "Mid: needs one tech step; stronger or more specialised.",
      "rank": 2,
      "max_keys": 3,
      "max_passive": 1,
      "max_keys_per_seat": 3,
      "source_rule": "Needs one tech building or upgrade beyond the basics."
    },
    {
      "id": "t3",
      "label": "T3",
      "description": "Late: top tech, elites and super-heavies. May carry an ultimate.",
      "rank": 3,
      "max_keys": 4,
      "max_passive": 1,
      "max_keys_per_seat": 3,
      "source_rule": "Needs top-level tech. A faction's end-game production building counts as top-level tech even where its prerequisite is shallow (a basic building, or none in the game data); say so in the source note."
    }
  ]
}
