{
  "$schema": "../../schemas/vocabulary.schema.json",
  "id": "source-kinds",
  "label": "Source kinds",
  "description": "Where a citation comes from, in order of preference.",
  "group": "supporting",
  "status": "draft",
  "version": "0.4.0",
  "terms": [
    {
      "id": "official",
      "label": "Official",
      "description": "Publisher or developer: manual, official site, patch notes, developer posts.",
      "rank": 1
    },
    {
      "id": "wiki",
      "label": "Established wiki",
      "description": "A large, maintained community wiki for the series.",
      "rank": 2
    },
    {
      "id": "database",
      "label": "Game database",
      "description": "Data-mined values or stat databases.",
      "rank": 3
    },
    {
      "id": "guide",
      "label": "Guide",
      "description": "Published strategy guides or long-standing community guides.",
      "rank": 4
    },
    {
      "id": "video",
      "label": "Video",
      "description": "Gameplay footage, cited with a timestamp in the note; official developer videos count as official.",
      "rank": 5
    },
    {
      "id": "community",
      "label": "Community",
      "description": "Forums and discussion threads. Low confidence on their own.",
      "rank": 6
    }
  ]
}
