{
  "$schema": "../../schemas/vocabulary.schema.json",
  "id": "faction-flavours",
  "label": "Faction flavours",
  "description": "Generic faction identities in Red Alert 3's spirit. A flavour makes its favoured parts three times as likely and one step more common for that faction (rare counts as uncommon, uncommon as common), so a grounded Soviet card can roll tesla weapons and an Allied card at spice 2 can roll prism. The step never applies to a class rarity, so a favoured cross-over (a flamethrower on a Soviet aircraft) still waits for high spice. It holds back its avoided parts until spice 3.",
  "group": "core",
  "status": "approved",
  "version": "1.1.0",
  "terms": [
    {
      "id": "soviet",
      "label": "Soviets",
      "description": "Heavy, brute force, electric weapons.",
      "themes": [
        "mass and armour",
        "tesla and electric weapons",
        "magnetism",
        "industrial salvage and recycling",
        "cheap numbers and crude reliability",
        "big walkers and airships"
      ],
      "favoured": {
        "weapon-families": ["tesla", "cannon", "flak", "flamethrower", "machine-gun", "magnetic", "drain"],
        "damage-types": ["electric", "armour-piercing", "explosive", "fire"],
        "mobility": ["tracks", "legs-biped", "legs-multi", "airship"],
        "mobility-traits": ["crush", "leap", "amphibious"],
        "bodies": ["hull-turret", "multi-turret", "chicken-walker", "envelope", "spider-frame"],
        "sizes": ["large", "huge"],
        "speed-bands": ["slow", "medium"],
        "armour-classes": ["heavy", "super-heavy"],
        "armour-models": ["damage-reduction", "ablative-plates", "directional"],
        "crew-models": ["driver-gunner", "driver-gunner-commander"],
        "aim-models": ["slow-turret", "free-aim"],
        "roles": ["assault", "anti-armour", "siege"],
        "team-play-hooks": ["protector", "escort-dependency", "swarm"]
      },
      "avoided": {
        "mobility-traits": ["teleport"],
        "armour-models": ["regen-shield", "charge-shield"]
      },
      "favoured_weight": 3,
      "avoided_until_spice": 3,
      "name_style": "Blunt, heavy words: tools, weather, beasts, numbers. Short and loud."
    },
    {
      "id": "allied",
      "label": "Allies",
      "description": "High-tech, precise, freezing and prism weapons.",
      "themes": [
        "precision and lock-on",
        "freeze-and-shatter",
        "prism light that splits",
        "time and space tricks",
        "stealth and disguise",
        "adaptable multi-role kit",
        "air power and shields"
      ],
      "favoured": {
        "weapon-families": ["prism", "laser", "cryo", "guided-missiles", "sniper", "autocannon", "sonic"],
        "damage-types": ["energy", "cryo", "armour-piercing", "sonic"],
        "mobility": ["wheels", "hover", "jet", "rotor"],
        "mobility-traits": ["teleport", "amphibious", "boost"],
        "bodies": ["hull-turret", "box-carrier", "fixed-wing", "rotorcraft"],
        "sizes": ["medium", "large"],
        "speed-bands": ["medium", "fast"],
        "armour-classes": ["light", "medium"],
        "armour-models": ["regen-shield", "charge-shield"],
        "crew-models": ["solo", "driver-gunner"],
        "weapon-delivery": ["lock-on", "beam", "hitscan"],
        "roles": ["disabler", "support", "anti-air", "scout", "transport", "infiltrator"],
        "team-play-hooks": ["setup-finisher", "seat-synergy", "spotter"]
      },
      "avoided": {
        "mobility-traits": ["crush"],
        "weapon-families": ["drain", "chemical"]
      },
      "favoured_weight": 3,
      "avoided_until_spice": 3,
      "name_style": "Clean, technical words: light, sky and cold imagery, short codes with a number."
    },
    {
      "id": "empire",
      "label": "Empire",
      "description": "Agile, transforming, blades and nano-tech.",
      "themes": [
        "transformation",
        "blades and close duels",
        "nano-tech that builds, repairs and swarms",
        "charged energy waves",
        "psionics",
        "kamikaze drones",
        "speed and discipline"
      ],
      "favoured": {
        "weapon-families": ["blades", "plasma", "nanites", "emp", "psionic", "guided-missiles", "drone-launcher"],
        "damage-types": ["melee", "energy", "emp", "psionic"],
        "mobility": ["hover", "legs-biped", "jet", "rotor"],
        "mobility-traits": ["transform", "leap", "boost", "amphibious"],
        "bodies": ["humanoid-mech", "power-suit", "disc", "spider-frame"],
        "sizes": ["small", "medium"],
        "speed-bands": ["fast", "very-fast"],
        "armour-classes": ["light", "medium"],
        "armour-models": ["evasive", "self-repair"],
        "crew-models": ["solo"],
        "weapon-delivery": ["melee", "attach", "beam", "ram"],
        "roles": ["raider", "disabler", "infiltrator"],
        "team-play-hooks": ["swarm", "bait-and-trap", "setup-finisher"]
      },
      "avoided": {
        "bodies": ["multi-turret"],
        "sizes": ["huge"],
        "armour-models": ["damage-reduction"]
      },
      "favoured_weight": 3,
      "avoided_until_spice": 3,
      "name_style": "Nature, animal and weather imagery and virtues; elegant two-part names."
    }
  ]
}
