{
  "$schema": "../../schemas/vocabulary.schema.json",
  "id": "cost-bands",
  "label": "Cost bands",
  "description": "Relative price. For source units it is relative within their own game (each game records its thresholds); for generated concepts it is derived from the parts.",
  "group": "supporting",
  "status": "draft",
  "version": "0.3.0",
  "terms": [
    {
      "id": "very-low",
      "label": "Very low",
      "description": "Among the cheapest units.",
      "rank": 1
    },
    {
      "id": "low",
      "label": "Low",
      "description": "Cheaper than a standard main unit.",
      "rank": 2
    },
    {
      "id": "medium",
      "label": "Medium",
      "description": "A standard main unit.",
      "rank": 3
    },
    {
      "id": "high",
      "label": "High",
      "description": "A premium or specialist unit.",
      "rank": 4
    },
    {
      "id": "very-high",
      "label": "Very high",
      "description": "Heroes, super-heavies and epic units.",
      "rank": 5
    }
  ]
}
