{
  "$schema": "../../schemas/vocabulary.schema.json",
  "id": "pattern-categories",
  "label": "Pattern categories",
  "description": "Groups for browsing mechanic patterns in the library. When several fit, pick the first in this order: conversion, infiltration, transport and garrison, mode change, summon, stealth and deception, control, defence, support, area, mobility, progression, weapon behaviour. A pattern may list up to two more categories for filtering.",
  "group": "supporting",
  "status": "draft",
  "version": "1.0.0",
  "terms": [
    {
      "id": "weapon-behaviour",
      "label": "Weapon behaviour",
      "description": "How a weapon works: chaining, charging, beams, splitting, switching."
    },
    {
      "id": "control",
      "label": "Control",
      "description": "Stops or hampers enemies: stun, root, silence, slow, freeze."
    },
    {
      "id": "infiltration",
      "label": "Infiltration",
      "description": "Gets inside enemy units or lines: infest, hijack, capture, steal."
    },
    {
      "id": "stealth-deception",
      "label": "Stealth and deception",
      "description": "Hides or fakes: cloak, disguise, decoy."
    },
    {
      "id": "mobility",
      "label": "Mobility",
      "description": "Moves in special ways: leap, dash, teleport, burrow."
    },
    {
      "id": "mode-change",
      "label": "Mode change",
      "description": "Switches form or stance: deploy, siege, transform."
    },
    {
      "id": "defence",
      "label": "Defence",
      "description": "Survives in special ways: shields, shield domes, countermeasures, armour tricks, self-repair."
    },
    {
      "id": "support",
      "label": "Support",
      "description": "Helps teammates: heal, repair, buff, resupply, find and mark enemies for them, gather resources for the team."
    },
    {
      "id": "transport-garrison",
      "label": "Transport and garrison",
      "description": "Carries or houses others; passengers matter."
    },
    {
      "id": "conversion",
      "label": "Conversion",
      "description": "Turns the enemy's strength into yours: leech, salvage, mind control."
    },
    {
      "id": "area",
      "label": "Area",
      "description": "Shapes the ground: mines, zones, cover and fortifications, terrain."
    },
    {
      "id": "summon",
      "label": "Summon",
      "description": "Spawns drones, turrets or minions."
    },
    {
      "id": "progression",
      "label": "Progression",
      "description": "Grows stronger during a life: veterancy, levels, kill streaks, stacking buffs."
    }
  ]
}
